"Argument","Description","Default","Choices"
"robot_model","model type of the Trossen Arm.","``wxai``","``wxai``,"
"arm_variant","End effector variant of the Trossen Arm.","``base``","``base``, ``leader``, ``follower``"
"arm_side","Side of the Trossen Arm. Note that only the wxai follower variant has a left and right side.","``none``","``none``, ``left``, ``right``"
"ip_address","IP address of the robot to connect to.","'192.168.1.2'",""
"ros2_control_hardware_type","Use real or mocked hardware interface.","``real``","``real``, ``mock_components``"
"use_world_frame","Use world frame if set to ``true``.","``false``","``true``, ``false``"
"use_rviz","launches RViz if set to ``true``.","``true``","``true``, ``false``"
"robot_description","URDF of the robot; this is typically generated by the xacro command.","Command(FindExec\(``xacro``\) + ' ' + LocalVar('FindPackageShare\(pkg= ``trossen_arm_description``\) + 'urdf' + LaunchConfig\(``robot_model``\)') + '.urdf.xacro ' + 'use_world_frame:=' + LaunchConfig\(``use_world_frame``\) + ' ' + 'arm_variant:=' + LaunchConfig\(``arm_variant``\) + ' ' + 'arm_side:=' + LaunchConfig\(``arm_side``\) + ' ' + 'ros2_control_hardware_type:=' + LaunchConfig\(``ros2_control_hardware_type``\) + ' ' + 'ip_address:=' + LaunchConfig\(``ip_address``\))",""
